{
  "schemaVersion": "1.0",
  "status": "authorized",
  "authorizedAt": "2026-10-22T00:00:00Z",
  "approvalFingerprint": "PLACEHOLDER",
  "targets": [
    { "type": "repo", "value": "./", "notes": "이 저장소(예시)" },
    { "type": "web", "value": "https://staging.example.test", "rateLimit": 10, "notes": "스테이징만, 초당 10건 이하" }
  ],
  "exclusions": ["https://staging.example.test/admin", "prod.example.test"],
  "window": { "start": "2026-10-22", "end": "2026-10-29" },
  "consent": {
    "authorizer": "홍길동",
    "role": "플랫폼팀 리드",
    "date": "2026-10-21",
    "reference": "SEC-1234"
  },
  "intrusiveness": "active-nondestructive"
}
